{
  "schema_version": "openplan.county_onramp_manifest.v1",
  "generated_at": "2026-03-24T23:53:10.428251+00:00",
  "name": "nevada-county-runtime-scalar0369-connectorbias2-20260324",
  "county_fips": null,
  "county_prefix": "NEVADA",
  "run_dir": "/home/nathaniel/.openclaw/workspace/openplan/data/screening-runs/nevada-county-runtime-scalar0369-connectorbias2-20260324",
  "mode": "existing-run",
  "stage": "validated-screening",
  "artifacts": {
    "scaffold_csv": "/tmp/nevada_example_scaffold.csv",
    "review_packet_md": "/tmp/nevada_example_review.md",
    "run_summary_json": "/home/nathaniel/.openclaw/workspace/openplan/data/screening-runs/nevada-county-runtime-scalar0369-connectorbias2-20260324/run_summary.json",
    "bundle_manifest_json": "/home/nathaniel/.openclaw/workspace/openplan/data/screening-runs/nevada-county-runtime-scalar0369-connectorbias2-20260324/bundle_manifest.json",
    "validation_summary_json": "/home/nathaniel/.openclaw/workspace/openplan/data/screening-runs/nevada-county-runtime-scalar0369-connectorbias2-20260324/validation/validation_summary.json",
    "activitysim_bundle_manifest_json": "/home/nathaniel/.openclaw/workspace/openplan/data/screening-runs/nevada-county-runtime-scalar0369-connectorbias2-20260324/behavioral_demand_prototype/activitysim_bundle/bundle_manifest.json",
    "behavioral_prototype_manifest_json": "/home/nathaniel/.openclaw/workspace/openplan/data/screening-runs/nevada-county-runtime-scalar0369-connectorbias2-20260324/behavioral_demand_prototype/behavioral_demand_prototype_manifest.json",
    "behavioral_runtime_manifest_json": "/home/nathaniel/.openclaw/workspace/openplan/data/screening-runs/nevada-county-runtime-scalar0369-connectorbias2-20260324/behavioral_demand_prototype/runtime/activitysim_runtime_manifest.json",
    "behavioral_runtime_summary_json": "/home/nathaniel/.openclaw/workspace/openplan/data/screening-runs/nevada-county-runtime-scalar0369-connectorbias2-20260324/behavioral_demand_prototype/runtime/activitysim_runtime_summary.json",
    "behavioral_ingestion_summary_json": "/home/nathaniel/.openclaw/workspace/openplan/data/screening-runs/nevada-county-runtime-scalar0369-connectorbias2-20260324/behavioral_demand_prototype/ingestion/activitysim_ingestion_summary.json",
    "behavioral_kpi_summary_json": "/home/nathaniel/.openclaw/workspace/openplan/data/screening-runs/nevada-county-runtime-scalar0369-connectorbias2-20260324/behavioral_demand_prototype/kpis/activitysim_behavioral_kpi_summary.json",
    "behavioral_kpi_packet_md": "/home/nathaniel/.openclaw/workspace/openplan/data/screening-runs/nevada-county-runtime-scalar0369-connectorbias2-20260324/behavioral_demand_prototype/kpis/activitysim_behavioral_kpi_packet.md"
  },
  "runtime": {
    "keep_project": false,
    "force": false,
    "overall_demand_scalar": null,
    "external_demand_scalar": null,
    "hbw_scalar": null,
    "hbo_scalar": null,
    "nhb_scalar": null
  },
  "summary": {
    "run": {
      "zone_count": 26,
      "population_total": null,
      "jobs_total": null,
      "loaded_links": 3174,
      "final_gap": null,
      "total_trips": 231828.75
    },
    "validation": {
      "validation_type": "screening_assignment_vs_observed_counts",
      "model_run_id": "nevada-county-runtime-scalar0369-connectorbias2-20260324",
      "model_engine": "AequilibraE screening runtime",
      "model_caveats": [
        "screening-grade only",
        "OSM default speeds/capacities",
        "tract fragments are not calibrated TAZs",
        "jobs are estimated from tract-scale demographic proxies",
        "external gateways are inferred from major boundary-crossing roads"
      ],
      "counts_source_csv": "/home/nathaniel/.openclaw/workspace/openplan/data/pilot-nevada-county/validation/caltrans_2023_priority_counts.csv",
      "model_geometry_source": "/home/nathaniel/.openclaw/workspace/openplan/data/screening-runs/nevada-county-runtime-scalar0369-connectorbias2-20260324/run_output/loaded_links.geojson",
      "model_project_db": "/home/nathaniel/.openclaw/workspace/openplan/data/screening-runs/nevada-county-runtime-scalar0369-connectorbias2-20260324/work/aeq_project/project_database.sqlite",
      "model_volume_field": "PCE_tot",
      "stations_total": 5,
      "stations_matched": 5,
      "stations_missed": 0,
      "screening_gate": {
        "status_label": "bounded screening-ready",
        "required_matches": 3,
        "ready_median_ape_threshold": 30.0,
        "ready_critical_ape_threshold": 50.0,
        "reasons": [
          "Matched stations >= 3, median absolute percent error <= 30.00%, and no matched facility exceeds 50.00% absolute percent error."
        ]
      },
      "metrics": {
        "median_absolute_percent_error": 16.01,
        "mean_absolute_percent_error": 23.13,
        "min_absolute_percent_error": 9.3,
        "max_absolute_percent_error": 49.48,
        "spearman_rho_facility_ranking": 1.0
      },
      "facility_ranking": [
        {
          "station": "SR 20 at Jct Rte 49",
          "observed_volume": 45500,
          "modeled_daily_pce": 32822,
          "obs_rank": 1,
          "mod_rank": 1
        },
        {
          "station": "SR 20 at Brunswick Rd",
          "observed_volume": 35500,
          "modeled_daily_pce": 30890,
          "obs_rank": 2,
          "mod_rank": 2
        },
        {
          "station": "SR 49 at South Grass Valley",
          "observed_volume": 26000,
          "modeled_daily_pce": 30162,
          "obs_rank": 3,
          "mod_rank": 3
        },
        {
          "station": "SR 20 at Penn Valley Dr",
          "observed_volume": 17500,
          "modeled_daily_pce": 19128,
          "obs_rank": 4,
          "mod_rank": 4
        },
        {
          "station": "SR 174 at Brunswick Rd",
          "observed_volume": 10300,
          "modeled_daily_pce": 15396,
          "obs_rank": 5,
          "mod_rank": 5
        }
      ],
      "created_at": "2026-03-24T22:21:42.928723+00:00"
    },
    "bundle_validation": {
      "counts_csv": "/home/nathaniel/.openclaw/workspace/openplan/data/pilot-nevada-county/validation/caltrans_2023_priority_counts.csv",
      "status_label": "bounded screening-ready",
      "matched_stations": 5,
      "metrics": {
        "median_absolute_percent_error": 16.01,
        "mean_absolute_percent_error": 23.13,
        "min_absolute_percent_error": 9.3,
        "max_absolute_percent_error": 49.48,
        "spearman_rho_facility_ranking": 1.0
      }
    },
    "scaffold": {
      "station_count": 5,
      "observed_volume_filled_count": 5,
      "observed_volume_missing_count": 0,
      "source_agency_filled_count": 5,
      "source_agency_tbd_count": 0,
      "source_description_filled_count": 5,
      "source_description_missing_count": 0,
      "ready_station_count": 5,
      "next_action_label": "All starter stations have observed counts and source metadata recorded. Tighten definitions if needed, then run validation."
    },
    "activitysim_bundle": {
      "status": "completed",
      "output_dir": "/home/nathaniel/.openclaw/workspace/openplan/data/screening-runs/nevada-county-runtime-scalar0369-connectorbias2-20260324/behavioral_demand_prototype/activitysim_bundle",
      "manifest_path": "/home/nathaniel/.openclaw/workspace/openplan/data/screening-runs/nevada-county-runtime-scalar0369-connectorbias2-20260324/behavioral_demand_prototype/activitysim_bundle/bundle_manifest.json",
      "land_use_rows": 26,
      "households": 41415,
      "persons": 102322,
      "skim_mode": "copy"
    },
    "behavioral_prototype": {
      "pipeline_status": "prototype_preflight_complete",
      "runtime_status": "behavioral_runtime_blocked",
      "runtime_mode": "preflight_only",
      "output_root": "/home/nathaniel/.openclaw/workspace/openplan/data/screening-runs/nevada-county-runtime-scalar0369-connectorbias2-20260324/behavioral_demand_prototype",
      "prototype_manifest_path": "/home/nathaniel/.openclaw/workspace/openplan/data/screening-runs/nevada-county-runtime-scalar0369-connectorbias2-20260324/behavioral_demand_prototype/behavioral_demand_prototype_manifest.json",
      "runtime_manifest_path": "/home/nathaniel/.openclaw/workspace/openplan/data/screening-runs/nevada-county-runtime-scalar0369-connectorbias2-20260324/behavioral_demand_prototype/runtime/activitysim_runtime_manifest.json",
      "runtime_summary_path": "/home/nathaniel/.openclaw/workspace/openplan/data/screening-runs/nevada-county-runtime-scalar0369-connectorbias2-20260324/behavioral_demand_prototype/runtime/activitysim_runtime_summary.json",
      "ingestion_summary_path": "/home/nathaniel/.openclaw/workspace/openplan/data/screening-runs/nevada-county-runtime-scalar0369-connectorbias2-20260324/behavioral_demand_prototype/ingestion/activitysim_ingestion_summary.json",
      "kpi_summary_path": "/home/nathaniel/.openclaw/workspace/openplan/data/screening-runs/nevada-county-runtime-scalar0369-connectorbias2-20260324/behavioral_demand_prototype/kpis/activitysim_behavioral_kpi_summary.json",
      "kpi_packet_path": "/home/nathaniel/.openclaw/workspace/openplan/data/screening-runs/nevada-county-runtime-scalar0369-connectorbias2-20260324/behavioral_demand_prototype/kpis/activitysim_behavioral_kpi_packet.md",
      "caveats": [
        "ActivitySim CLI is not installed or not on PATH"
      ]
    }
  }
}
